{
  "schema_version": "math-gold125-trajectory-0.1.0",
  "problem_id": "MATH-GOLD-049",
  "source_dataset": "Hendrycks MATH train parquet",
  "source_row_id": "train-row-08913",
  "source_hash": "52c9185615cf273a0041f2d252d36b3ae317273623c7c0f1fdc7c5245a969b4b",
  "category": "Counting & Probability",
  "level": "Level 4",
  "problem": "For each integer $n$, let $f(n)$ be the sum of the elements of the $n$th row (i.e. the row with $n+1$ elements) of Pascal's triangle minus the sum of all the elements from previous rows. For example, \\[f(2) = \\underbrace{(1 + 2 + 1)}_{\\text{2nd row}} - \\underbrace{(1 + 1 + 1)}_{\\text{0th and 1st rows}} = 1. \\]What is the minimum value of $f(n)$ for $n \\ge 2015$?",
  "original_solution": "Suppose $m \\ge 1$. The sum of the elements of the $m$th row is simply \\[\\sum_{i=0}^{m} \\binom{m}{i} = \\sum_{i=0}^m \\binom{m}{i}1^i = (1+1)^m=2^m\\] by the binomial theorem. Thus the sum of the elements of the $k$th row, for $k \\le n$, is $2^k$, so the total sum of all the elements of the previous rows is \\[\\sum_{k=0}^{n-1} 2^k = \\frac{2^n-1}{2-1} = 2^n-1\\] by the formula for the sum of a geometric series. Therefore, $f(n)=2^n-(2^n-1)=1$ for all $n \\ge 2015$. (That is, it is a constant!) Thus, the minimum value is clearly $\\boxed{1}$.",
  "selection_reason": "Selected for semantic diversity in Counting & Probability at Level 4; targeted complex, construction, function, geometry, inequality and active-coverage pressure beyond the frozen Gold-25.",
  "targeted_semantic_features": [
    "complex",
    "construction",
    "function",
    "geometry",
    "inequality"
  ],
  "initial_state": {
    "objects": [
      "source mathematical problem"
    ],
    "declarations": [],
    "types_domains": [
      "integer/natural domain"
    ],
    "facts": [
      {
        "id": "fact:problem",
        "statement": "For each integer $n$, let $f(n)$ be the sum of the elements of the $n$th row (i.e. the row with $n+1$ elements) of Pascal's triangle minus the sum of all the elements from previous rows. For example, \\[f(2) = \\underbrace{(1 + 2 + 1)}_{\\text{2nd row}} - \\underbrace{(1 + 1 + 1)}_{\\text{0th and 1st rows}} = 1. \\]What is the minimum value of $f(n)$ for $n \\ge 2015$?",
        "status": "given"
      }
    ],
    "assumptions": [],
    "constraints": [],
    "definitions": [],
    "goals": [
      {
        "id": "goal:answer",
        "statement": "answer the source problem",
        "status": "goal_open"
      }
    ],
    "subgoals": [],
    "candidates": [],
    "branch_state": [],
    "scope": [
      "global"
    ],
    "dependencies": [],
    "open_obligations": [],
    "discharged_obligations": [],
    "epistemic_status": [],
    "id": "S0"
  },
  "steps": [
    {
      "step_id": "s1",
      "source_span": "Suppose $m \\ge 1$.",
      "explicitness": "explicit",
      "reasoning_mode": "EXECUTION",
      "atomicity": "UNCERTAIN",
      "macro_components": [],
      "warrant": {
        "kind": "source_sentence_warrant",
        "description": "The source solution presents this operation/result in the preserved span; no stronger formal theorem certificate is inferred.",
        "source": "source_interpretation",
        "evidence_status": "SOURCE_GROUNDED"
      },
      "preconditions": [],
      "creates_obligations": [],
      "discharges_obligations": [],
      "dependencies": [
        "fact:problem"
      ],
      "dependency_evidence": [
        {
          "dependency": "fact:problem",
          "kind": "initial-given",
          "confidence": "medium"
        }
      ],
      "scope": {
        "name": "global",
        "branch": null,
        "branch_depth": 0
      },
      "verification": {
        "status": "SOURCE_GROUNDED",
        "category": "EXACT_SOURCE_AND_STATE_AUDIT",
        "backend": "source-span and structural audit",
        "notes": "The result statement is exactly the source span; formal mathematical replay is not claimed for automatic extraction."
      },
      "hml_support": {
        "status": "REPRESENTABLE_ONLY",
        "constructs": [
          "assume",
          "evidence",
          "goal"
        ],
        "notes": "The claim can be recorded as state, but current HML does not provide a trusted domain/meta checker for this transition."
      },
      "semantic_gap_ids": [
        "MATH-GAP-0008"
      ],
      "state_before": {
        "objects": [
          "source mathematical problem"
        ],
        "declarations": [],
        "types_domains": [
          "integer/natural domain"
        ],
        "facts": [
          {
            "id": "fact:problem",
            "statement": "For each integer $n$, let $f(n)$ be the sum of the elements of the $n$th row (i.e. the row with $n+1$ elements) of Pascal's triangle minus the sum of all the elements from previous rows. For example, \\[f(2) = \\underbrace{(1 + 2 + 1)}_{\\text{2nd row}} - \\underbrace{(1 + 1 + 1)}_{\\text{0th and 1st rows}} = 1. \\]What is the minimum value of $f(n)$ for $n \\ge 2015$?",
            "status": "given"
          }
        ],
        "assumptions": [],
        "constraints": [],
        "definitions": [],
        "goals": [
          {
            "id": "goal:answer",
            "statement": "answer the source problem",
            "status": "goal_open"
          }
        ],
        "subgoals": [],
        "candidates": [],
        "branch_state": [],
        "scope": [
          "global"
        ],
        "dependencies": [],
        "open_obligations": [],
        "discharged_obligations": [],
        "epistemic_status": [],
        "id": "S0"
      },
      "state_after": {
        "objects": [
          "source mathematical problem"
        ],
        "declarations": [],
        "types_domains": [
          "integer/natural domain"
        ],
        "facts": [
          {
            "id": "fact:problem",
            "statement": "For each integer $n$, let $f(n)$ be the sum of the elements of the $n$th row (i.e. the row with $n+1$ elements) of Pascal's triangle minus the sum of all the elements from previous rows. For example, \\[f(2) = \\underbrace{(1 + 2 + 1)}_{\\text{2nd row}} - \\underbrace{(1 + 1 + 1)}_{\\text{0th and 1st rows}} = 1. \\]What is the minimum value of $f(n)$ for $n \\ge 2015$?",
            "status": "given"
          },
          {
            "id": "fact:s1",
            "statement": "Suppose $m \\ge 1$.",
            "status": "source_grounded",
            "scope": "global"
          }
        ],
        "assumptions": [],
        "constraints": [],
        "definitions": [],
        "goals": [
          {
            "id": "goal:answer",
            "statement": "answer the source problem",
            "status": "goal_open"
          }
        ],
        "subgoals": [],
        "candidates": [],
        "branch_state": [],
        "scope": [
          "global"
        ],
        "dependencies": [
          "fact:problem"
        ],
        "open_obligations": [],
        "discharged_obligations": [],
        "epistemic_status": [],
        "id": "S1"
      },
      "state_change": {
        "from": "S0",
        "to": "S1",
        "added_facts": [
          "fact:s1"
        ],
        "added_obligations": [],
        "removed_obligations": [],
        "scope_effect": "global/current",
        "dependency_effect": [
          "fact:problem"
        ],
        "epistemic_update": "Source-grounded result fact:s1 recorded from the exact motivating span."
      },
      "action": {
        "operation_id": "OTHER",
        "family": "UNRESOLVED",
        "arguments": {
          "source_sentence_index": 1,
          "candidate_core": "UNRESOLVED",
          "layer_class": "UNRESOLVED"
        },
        "candidate_core": "UNRESOLVED",
        "layer_class": "UNRESOLVED"
      },
      "result": {
        "id": "fact:s1",
        "statement": "Suppose $m \\ge 1$.",
        "status": "source_grounded",
        "claim_source": "verbatim_source_span"
      },
      "meta_step_ids": []
    },
    {
      "step_id": "s2",
      "source_span": "The sum of the elements of the $m$th row is simply \\[\\sum_{i=0}^{m} \\binom{m}{i} = \\sum_{i=0}^m \\binom{m}{i}1^i = (1+1)^m=2^m\\] by the binomial theorem.",
      "explicitness": "explicit",
      "reasoning_mode": "EXECUTION",
      "atomicity": "ATOMIC",
      "macro_components": [],
      "warrant": {
        "kind": "source_sentence_warrant",
        "description": "The source solution presents this operation/result in the preserved span; no stronger formal theorem certificate is inferred.",
        "source": "explicit_source",
        "evidence_status": "SOURCE_GROUNDED"
      },
      "preconditions": [],
      "creates_obligations": [],
      "discharges_obligations": [],
      "dependencies": [
        "fact:s1"
      ],
      "dependency_evidence": [
        {
          "dependency": "fact:s1",
          "kind": "adjacent-source-result",
          "confidence": "medium"
        }
      ],
      "scope": {
        "name": "global",
        "branch": null,
        "branch_depth": 0
      },
      "verification": {
        "status": "SOURCE_GROUNDED",
        "category": "EXACT_SOURCE_AND_STATE_AUDIT",
        "backend": "source-span and structural audit",
        "notes": "The result statement is exactly the source span; formal mathematical replay is not claimed for automatic extraction."
      },
      "hml_support": {
        "status": "PARTIAL",
        "constructs": [
          "state",
          "goal",
          "scope",
          "evidence"
        ],
        "notes": "The state shape is representable; full executable support depends on the exact rule and evidence."
      },
      "semantic_gap_ids": [
        "MATH-GAP-0008"
      ],
      "state_before": {
        "objects": [
          "source mathematical problem"
        ],
        "declarations": [],
        "types_domains": [
          "integer/natural domain"
        ],
        "facts": [
          {